{
  "schema_version": "1.0",
  "inventory_id": "r8-interface-inventory",
  "baseline_revision": "4ac1ab77218e40ebb9f9bb4297d6e02fa6462f16",
  "pre_r8_status": "pending",
  "interfaces": [
    {
      "interface_id": "artifact.public-run-result",
      "kind": "artifact",
      "owner": "runner",
      "stability": "stable_candidate",
      "version_range": "0.3 through 0.9",
      "fixture_path": "examples/contracts/result.json",
      "verification_gate": "end-to-end",
      "projection": "public",
      "authority": "normative",
      "trust_boundary": "public-artifact",
      "bounds_documented": true,
      "parser_behavior_documented": true,
      "precondition_status": "satisfied",
      "limitations": []
    },
    {
      "interface_id": "benchmark.official-cloud-v1",
      "kind": "artifact",
      "owner": "evaluation",
      "stability": "stable_candidate",
      "version_range": "1.0 candidate",
      "fixture_path": "examples/contracts/v1.0/official-benchmark-pack.json",
      "verification_gate": "benchmark-science",
      "projection": "public",
      "authority": "benchmark-policy",
      "trust_boundary": "evaluation-core",
      "bounds_documented": true,
      "parser_behavior_documented": true,
      "precondition_status": "satisfied",
      "limitations": []
    },
    {
      "interface_id": "cli.hunteval-r7",
      "kind": "cli",
      "owner": "cli",
      "stability": "stable_candidate",
      "version_range": "R7 command surface",
      "fixture_path": "crates/hunteval-cli/tests/benchmark_validate.rs",
      "verification_gate": "end-to-end",
      "projection": "public",
      "authority": "operator",
      "trust_boundary": "local-process",
      "bounds_documented": true,
      "parser_behavior_documented": true,
      "precondition_status": "satisfied",
      "limitations": []
    },
    {
      "interface_id": "protocol.deployment-jsonl",
      "kind": "protocol",
      "owner": "protocol",
      "stability": "stable_candidate",
      "version_range": "0.3",
      "fixture_path": "examples/contracts/protocol-transcript.json",
      "verification_gate": "adversarial-protocol",
      "projection": "public",
      "authority": "normative",
      "trust_boundary": "deployment-process",
      "bounds_documented": true,
      "parser_behavior_documented": true,
      "precondition_status": "satisfied",
      "limitations": []
    },
    {
      "interface_id": "schema.contract-families",
      "kind": "schema",
      "owner": "domain",
      "stability": "stable_candidate",
      "version_range": "0.3 through 0.9",
      "fixture_path": "examples/contracts/v0.9/sdk-compatibility-index.json",
      "verification_gate": "tests",
      "projection": "public",
      "authority": "normative",
      "trust_boundary": "public-contract",
      "bounds_documented": true,
      "parser_behavior_documented": true,
      "precondition_status": "satisfied",
      "limitations": []
    },
    {
      "interface_id": "topology.deployment-v0.6",
      "kind": "topology",
      "owner": "domain",
      "stability": "stable_candidate",
      "version_range": "0.6",
      "fixture_path": "examples/contracts/v0.6/deployment-topology.json",
      "verification_gate": "benchmark-science",
      "projection": "public",
      "authority": "normative",
      "trust_boundary": "public-contract",
      "bounds_documented": true,
      "parser_behavior_documented": true,
      "precondition_status": "satisfied",
      "limitations": []
    },
    {
      "interface_id": "diagnosis.evidence-backed-v0.7",
      "kind": "report",
      "owner": "diagnostics",
      "stability": "stable_candidate",
      "version_range": "0.7",
      "fixture_path": "examples/contracts/v0.7/diagnostic-report.json",
      "verification_gate": "evidence-backed-diagnosis",
      "projection": "public",
      "authority": "observation",
      "trust_boundary": "offline-analysis",
      "bounds_documented": true,
      "parser_behavior_documented": true,
      "precondition_status": "satisfied",
      "limitations": []
    },
    {
      "interface_id": "improvement.controlled-v0.8",
      "kind": "artifact",
      "owner": "improvement",
      "stability": "stable_candidate",
      "version_range": "0.8",
      "fixture_path": "examples/contracts/v0.8/improvement-report.json",
      "verification_gate": "controlled-improvement",
      "projection": "public",
      "authority": "human-approved",
      "trust_boundary": "offline-analysis",
      "bounds_documented": true,
      "parser_behavior_documented": true,
      "precondition_status": "satisfied",
      "limitations": []
    },
    {
      "interface_id": "knowledge.analytical-v0.9",
      "kind": "knowledge",
      "owner": "knowledge",
      "stability": "stable_candidate",
      "version_range": "0.9",
      "fixture_path": "examples/contracts/v0.9/analytical-result.json",
      "verification_gate": "knowledge-and-extensions",
      "projection": "public",
      "authority": "observation",
      "trust_boundary": "offline-analysis",
      "bounds_documented": true,
      "parser_behavior_documented": true,
      "precondition_status": "satisfied",
      "limitations": []
    },
    {
      "interface_id": "metric.raw-vector-v0.4",
      "kind": "metric",
      "owner": "evaluation",
      "stability": "stable_candidate",
      "version_range": "0.4",
      "fixture_path": "examples/contracts/v0.4/benchmark-state.json",
      "verification_gate": "benchmark-science",
      "projection": "public",
      "authority": "objective-measurement",
      "trust_boundary": "evaluation-core",
      "bounds_documented": true,
      "parser_behavior_documented": true,
      "precondition_status": "satisfied",
      "limitations": []
    },
    {
      "interface_id": "platform.linux-x86_64",
      "kind": "platform",
      "owner": "sandbox",
      "stability": "stable_candidate",
      "version_range": "x86_64-unknown-linux-gnu with Bubblewrap",
      "fixture_path": "examples/contracts/v0.5/sandbox-capability-report.json",
      "verification_gate": "security",
      "projection": "public",
      "authority": "host-capability",
      "trust_boundary": "operating-system",
      "bounds_documented": true,
      "parser_behavior_documented": true,
      "precondition_status": "satisfied",
      "limitations": []
    },
    {
      "interface_id": "platform.macos-aarch64",
      "kind": "platform",
      "owner": "release",
      "stability": "preview",
      "version_range": "aarch64-apple-darwin",
      "fixture_path": "examples/contracts/v1.0/platform-target-matrix.json",
      "verification_gate": "package",
      "projection": "public",
      "authority": "native-platform-gate",
      "trust_boundary": "operating-system",
      "bounds_documented": true,
      "parser_behavior_documented": true,
      "precondition_status": "satisfied",
      "limitations": ["Native packaging passed; no scored-execution sandbox is declared."]
    },
    {
      "interface_id": "platform.macos-x86_64",
      "kind": "platform",
      "owner": "release",
      "stability": "preview",
      "version_range": "x86_64-apple-darwin",
      "fixture_path": "examples/contracts/v1.0/platform-target-matrix.json",
      "verification_gate": "package",
      "projection": "public",
      "authority": "native-platform-gate",
      "trust_boundary": "operating-system",
      "bounds_documented": true,
      "parser_behavior_documented": true,
      "precondition_status": "satisfied",
      "limitations": ["Native packaging passed; no scored-execution sandbox is declared."]
    },
    {
      "interface_id": "platform.windows-x86_64",
      "kind": "platform",
      "owner": "release",
      "stability": "preview",
      "version_range": "x86_64-pc-windows-msvc",
      "fixture_path": "examples/contracts/v1.0/platform-target-matrix.json",
      "verification_gate": "package",
      "projection": "public",
      "authority": "native-platform-gate",
      "trust_boundary": "operating-system",
      "bounds_documented": true,
      "parser_behavior_documented": true,
      "precondition_status": "satisfied",
      "limitations": ["Native packaging passed; no scored-execution sandbox is declared."]
    },
    {
      "interface_id": "report.normalized-v0.4",
      "kind": "report",
      "owner": "reporting",
      "stability": "stable_candidate",
      "version_range": "0.4",
      "fixture_path": "examples/contracts/v0.4/report-claim.json",
      "verification_gate": "benchmark-science",
      "projection": "public",
      "authority": "derived-report",
      "trust_boundary": "offline-analysis",
      "bounds_documented": true,
      "parser_behavior_documented": true,
      "precondition_status": "satisfied",
      "limitations": []
    },
    {
      "interface_id": "scoring.versioned-profile-v0.4",
      "kind": "scoring_profile",
      "owner": "evaluation",
      "stability": "stable_candidate",
      "version_range": "0.4",
      "fixture_path": "examples/contracts/v0.4/scoring-profile.yaml",
      "verification_gate": "benchmark-science",
      "projection": "public",
      "authority": "benchmark-policy",
      "trust_boundary": "evaluation-core",
      "bounds_documented": true,
      "parser_behavior_documented": true,
      "precondition_status": "satisfied",
      "limitations": []
    },
    {
      "interface_id": "extension.managed-tool-v0.9",
      "kind": "extension",
      "owner": "knowledge",
      "stability": "stable_candidate",
      "version_range": "0.9",
      "fixture_path": "examples/contracts/v0.9/extension-conformance-result.json",
      "verification_gate": "knowledge-and-extensions",
      "projection": "public",
      "authority": "runner-managed-tool",
      "trust_boundary": "extension-process",
      "bounds_documented": true,
      "parser_behavior_documented": true,
      "precondition_status": "satisfied",
      "limitations": []
    },
    {
      "interface_id": "sdk.python-r7",